published_at,updated_at,like_count,text
2021-06-12T08:45:23Z,2021-06-12T08:45:23Z,0,"I can&#39;t believe that grocery shopping in the Netherlands is better than for example in America. There are indeed a lot of small supermarkets in cities. The dominant one is Albert Heijn. And whether you go to Amsterdam, to Groningen or anywhere else in The Netherlands, all the products at Albert Heijn are the same. regional products have been killed by them. Also, the quality of the AH products is very disappointing. Almost everything they sell is industrial, bad quality food, full of additions and preservatives. Because the supermarkets in The Netherlands are small and the products are everywhere the same, the variety of choice is very limited. O by the way, in all other brands supermarkets, the products are the same as in AH: industrial and with limited choise. I still can&#39;t believe that in a modern society as the Dutch is, the people still put up with this. I recommend you to go to France, Germany or even Belgium to see the big variety of choice in good quality products is there to be found. Oh, and I am Dutch and lived all my life in The Netherlands."
2021-06-11T02:30:31Z,2021-06-11T02:30:31Z,2,"Calm down with the complete and utter fallacy.  I live in a big city in America, my big grocery stores are 5-10 mins away.  I buy in bulk and don&#39;t pay the poor tax.  I buy fresh produce/meats weekly for whatever delicious meals we&#39;re making.  Are you referring to the suburbs or rural areas of America?  I mean yea go to Amsterdam and miss out on all the business you can do here in America but hey Amsterdam and no cars are really neat right? Or whatever you have to tell yourself to make yourself feel better."
2021-06-10T21:13:29Z,2021-06-10T21:13:29Z,0,Dude worst thing is amsterdam is porbly the worst
2021-06-09T12:21:37Z,2021-06-09T12:21:37Z,0,duuuude! you should be payed by amsterdam for making this videos!
2021-06-09T05:15:23Z,2021-06-09T05:15:23Z,2,"I am glad ou like shopping in Amsterdam that is the way we do that, US people have hardly no idea who the rest of the world lifes because they are not interested in that at all."
2021-06-08T05:01:42Z,2021-06-08T05:01:42Z,5,I like to make my home a convenience store so I don&#39;t need to leave the house for days.
